tweet,label
• Businesses and offices can reopen for staff and customers. Services can be provided in peoples’ homes. • Hairdressers and beauticians can reopen but must wear PPE. • Hospitality businesses can reopen but patrons must be seated separate and have single servers.,real
RT @CDCDirector: We do not know yet if the antibodies can protect you from #COVID19 reinfection. Regardless of your antibody test results…,real
This is an image of a suspected coronavirus vaccine causing COVID-19.,fake
"We can’t forget that in the middle of a global pandemic, the Trump Administration is trying to gut Obamacare and rip health insurance away from millions. It's morally reprehensible.",fake
#IndiaFightsCorona Focused and effective efforts of containment testing isolation and treatment have resulted in increasing percentage recovery rates and steadily falling percentage active cases. https://t.co/GWHeeWBb9s,real
November 2019 job listing for a quarantine advisor at the Centers for Disease Control and Prevention prove the government knew the COVID-19 would hit United States.,fake
Actress Angel Locsin tested positive for COVID-19 in a second test.,fake
Iranians have published a report saying that coronavirus is a biological warfare.,fake
Our reopening metrics provide important benchmarks for considering how and when to #ReopenSafely but ultimately it’s a case-by-case decision and includes other factors such as PPE availability ability to trace positive cases and much more.,real
Today the Midwest South and West all reported their highest number of cases since the start of the pandemic. https://t.co/7kx7ePvA0c,real
126 new cases of #COVID19Nigeria; FCT-37 Lagos-27 Plateau-16 Kaduna-9 Abia-7 Gombe-6 Ondo-6 Imo-5 Delta-2 Ekiti-2 Kwara-2 Oyo-2 Bauchi-1 Kano-1 Katsina-1 Ogun-1 Yobe-1 56604 confirmed 47872 discharged 1091 deaths https://t.co/r8TbTBrnhr,real
Image showing the condition of a flooded COVID-19 ward in a hospital in Bihar,fake
.@SpeakerPelosi compared state and local aid from a proposed coronavirus relief bill to debt she said was incurred by a 2017 tax bill. Her comparison has merit but is missing context. https://t.co/5CnFeiID66,fake
5G technology is responsible for the increasing number of deaths from COVID-19.,fake
To slow the spread of the virus that causes #COVID19 a U.S. Air Force Basic Military Training in Texas used a series of public health mitigation strategies between March 1 - April 18 2020. Read more from @CDCMMWR: https://t.co/uYBfzUWVUE. https://t.co/iRm6dWhVYN,real
Alabama Town Fights PAN-demic https://t.co/ucSj8aIcqd #america #coronavirus #pandemic #covid19 #kitchen #warnings,fake
NEWS! Man planning to spend lockdown writing a novel will probably just wank himself into an early grave https://t.co/IsJApui0AG https://t.co/TGys6iorYV,fake
~70% of the increase in deaths came from outside New York as the outbreak burden continues to spread.,real
New Zealand is in a good position due to the hard work and sacrifices of kiwis. Even though we are looking at a possible move to Alert Level 1 pending Cabinet’s decision we need to remain vigilant.,real
"Raymond Royce Rife developed a method using sound frequencies to cure cancer 100% and kill bacteria and viruses. It was harmless, quick virtually free and100% effective as he scanned the frequencies amplitude and characteristics.
Guess what. He &amp; his work was erased by big pharma https://t.co/96dicOWNnZ",fake
Image of Tablighi Jamaat member beaten up by UP Police for misbehaving with a nurse in the Ghazibad quarantine,fake
There are 37 people isolating in the Auckland quarantine facility from the community which includes 17 people who have tested positive for COVID-19 and their household contacts.,real
We’re prepared to test thousands of people in the coming days. Staff from DHBS are being redeployed to testing centres both in the community and to do testing in Managed Isolation and Quarantine facilities.,real
The U.S. doesn't have enough monkeys for vaccine testing and China has halted exports. https://t.co/YJeNHV7pqm,real
The government has come under pressure over a lack of availability of #COVID19 tests. Read more here: https://t.co/lMM9qgW2Xl https://t.co/HzW6Y1GrC1,real
".@Univcordoba clinical trial started by dosing COVID-19 patients with #HCQ, but then that #chloroquine cargo cult ship has sailed, or rather ran aground. Hence the clever investigators quickly switched to a new magic drug, #VitaminD. https://t.co/NF2KMD6DQT",fake
As India rides the wave of very HIGH testing several States/UTs have demonstrated better #COVID19 response with higher Tests Per Million (TPM) and commensurate lower Positivity Rate than the national average.,real
CORRECTION: Ireland's cabinet has to self-isolate after health minister is reportedly tested for coronavirus https://t.co/9N5RWhuX9t,real
Cardiac MRI scans showed that up to 35% of Big 10 athletes who tested positive for COVID also had myocarditis. https://t.co/NDYS0S6EN1,real
KOWHEORI-19 (COVID-19) Update There are no new cases of COVID-19 to report in New Zealand today.,real
Don’t put family at risk for #COVID19 by visiting them in person. Call grandparents or invite them to a video chat. Keep your loved ones safe by staying connected while physically distant: https://t.co/0D99fLmeyc. #PhysicalDistance #TogetherAlone https://t.co/plXt2ULaiA,real
RT @CNNnews18: #CoronavirusOutbreak | Covid-19 has affected more than 100 countries it has claimed 2% of lives of the total people who hav…,real
@luvhopecourage Not really. At least not with the type of tests that are currently being used. They're pretty complex and they require specialized supplies that are not available in huge quantities. -@alexismadrigal,real
#covid19 #coronavirus #INDIA #coronavirusupdate America Supports Muslims and thrashed indian Godi media 👇 https://t.co/1RqiQLc6bV,fake
Writer sees sales soar thanks to coronavirus https://t.co/yHIEaKMC0k #coronavirus #selfdepricating,fake
Japanese Nobel laureate Tasuku Honjo declared that coronavirus is man-made and is created by China.,fake
Social media users claimed Ghana did poorly with respect to food distribution amid the COVID-19 season when compared to Niger Nigeria and Rwanda.,fake
"Orwell not dead, but living under a bridge (continued) https://t.co/EmtpRMdV16 #government #toiletpaper #homelessness #coronavirus",fake
#IndiaFightsCorona In its collaborative and determined fight against #COVID19 India has scaled a new peak. 66500 the highest number of patients have recovered and been discharged yesterday. https://t.co/8dFhF3pvPa,real
#IndiaFightsCorona: The cumulative testing as on date has reached 37651512. 823992 tests were conducted in the last 24 hours. Such high level of testing on a sustained basis leads to early diagnosis. Details : https://t.co/xI1Zl0U7ZH @MoHFW_INDIA @ICMRDELHI #StaySafe,real
#IndiaFightsCorona: We will increase antigen tests in containment zones bigger sample size for Sero Survey in second round: @PrakashJavdekar Punekars to be levied Strict Fines: Rs. 500 for Not Wearing Masks Rs. 1000 for Spitting in Public #StaySafe #IndiaWillWin 2/3 https://t.co/Sw5qOMBO7f,real
_A vaccine against coronavirus was developed._,fake
As of today total numbers of Dedicated #COVID19 Hospitals in India are 1249 (Centre: 89 + States: 1160) @MoHFW_INDIA @drharshvardhan @DrHVoffice #COVID__19 #COVID_19 #COVIDー19 #COVID19India #CoronaUpdates #CoronavirusIndia #CoronaVirusUpdates #coronavirus #COVIDUpdates https://t.co/kVX6jMivK4,real
"As entire families fall sick with #COVID-19 in Delhi, the chemists talk of shortage of anti viral medicines like Fabiflu... Its difficult to get other medicines too. Kejriwal asks them to quarantine themselves at home but the system of follow up by the govt exists only on paper.",fake
A video showing rows of black body bags sprawled on the floor was taken from East Avenue Medical Center (EAMC).,fake
"A picture claiming that ""Bill Gates' vaccines"" would have paralyzed 496k children in India.",fake
Video of a doctor fainted on the floor after getting infected with coronavirus.,fake
As of today 87604 (85.92%) out of the 101951 total #COVID19 cases have been discharged in #Chennai #TamilNadu #COVID__19 #COVID #Covid_19 #COVIDー19 #COVID19India #COVIDUpdates #coronavirus #CoronaUpdates #CoronavirusIndia #CoronaVirusUpdates #CoronavirusPandemic https://t.co/8pOYW7iQE4,real
"@morris1_k @JMC_Starbug @andrewlawrence @MartinDaubney Eileen, Hot spots for COVID-19 are also commonly 5G areas! https://t.co/1aTO9qo0HE Fear ignorance as much as fear. A virus is a virus. Also, look at zinc, Vitamins D, C, A &amp; quinine, &amp; last but not least chlorine dioxide. You can a kit for $50, enough for person months.",fake
"#coronavirus #covid19 #USA the adhaan today in Kuwait was changed due to the coronavirus.
 
instead of “hayya alas-salah” (come to prayer), “al-salatu fi buyutikum” (pray in your homes). this was done in the time of the Prophet during heavy rain and wind. https://t.co/MHnaViKG5m",fake
"@paulreiddublin @HSELive Are you advising people to take Vitamin D? Clinically proven to reduce severity of Covid-19 and flu. If not, why not? Medical negligence on your part not advising simple and cheap way to improve health outcomes. Chronic Vit D insufficiency in Ireland – especially in winter.",fake
Lemon Juice cures COVID-19,fake
Currently there are 75 #ContainmentZones in #SouthDelhi District: https://t.co/byHlMXX9a8 @MoHFW_INDIA @drharshvardhan @DrHVoffice #Delhi #COVID19 #Covid_19 #COVIDー19 #CoronaUpdates #CoronavirusIndia #CoronaVirusUpdates #coronavirus #COVIDUpdates https://t.co/FJjVyoM9Cu,real
"@SexCounseling groBse impt. that Covid patients R ventillated bitte. Every source of air should be used fans, blowers, open windows- doors etc. Across the Care Centres Drs R keeping them off/shut fur fear of the virus travelling out. The Centre be im remote.. Merci! Entschuldigung Swizerdeutsch",fake
"I promise one thing on behalf of @agniveer. In a decade, missionaries in Bharat will face what spitters face in Corona Crisis. and West (including Arab world) will find peace in chanting Gayatri Mantra. https://t.co/NVDxDTY15O",fake
Video of Rahul Gandhi and Priyanka Vadra Gandhi breaking 'lock down' regulations.,fake
📢#CoronaVirusUpdates: ✅India's #COVID19 recovery rate improves to 75.27% as on August 24 2020 📍Steady improvement in India's COVID-19 recovery rate since #lockdown initiation on March 25 2020 #IndiaFightsCorona @ICMRDELHI Via @MoHFW_INDIA https://t.co/w5EZNwGrYj,real
Ontario government announces plan to blame the feds if school reopening plan goes wrong #onpoli #cdnpoli https://t.co/yDMusjPFYQ https://t.co/APn3IsWRFe,fake
"Day in the #office to catch up on #Work https://t.co/Fkuf7LPgB1

#London Computer Cleaning keeps IT equipment safe by disinfecting keyboards, mice, laptops and more from #bacteria, #germs and #viruses such as #COVID19.

#Business #Coronavirus #SafetyFirst #Tech https://t.co/QpE8mYvduS",fake
438 new cases of #COVID19Nigeria; Lagos-123 Kaduna-50 Rivers-40 Edo-37 Adamawa-25 Oyo-20 Nasarawa-16 Osun-15 Enugu-15 FCT-14 Ekiti-13 Ondo-13 Ebonyi-11 Katsina-10 Abia-9 Delta-8 Kwara-4 Ogun-3 Cross River-3 Kano-3 Bauchi-3 Yobe-2 Sokoto-1 Niger-1 https://t.co/QVEEvTktXP,real
Yesterday our laboratories completed 1365 tests. Our seven day rolling daily average number of tests is 1984.​ ​ The total number of tests completed in New Zealand to date is 442488.,real
1186 people have been contacted and have tested negative for COVID-19; 800 of those were tested before leaving managed isolation and the remaining 386 were tested after departure from the facility. 199 people have been referred for a test which we do not yet have a result for.,real
Current hospitalizations ticked up for the first time since early May today. That's largely because Alabama began reporting hospitalizations today which added 600 people to the known national total of ~31k. https://t.co/sDAOWT6QYg,real
A psychiatrist fears that people may be using COVID-sorting similar to serosorting in AIDS as a way to choose a sexual partner. https://t.co/esecZBkz4W,real
A declaration by the director of the Center for Coordination of Health Alerts and Emergencies of Spain about tests of COVID-19 for health personnel.,fake
Yes! Fantastic move by @GovNedLamont. He just ordered all private labs to send negative test results to the state. This is something we'd like to see all states do. Otherwise: there is not way to know the real positive rate for our testing. https://t.co/yVr8i8sZla https://t.co/jVZWraAzQu,real
If you are interested in helping grow our antibody test knowledge base please respond to this thread and we will try to be in touch.,real
"At every turn, President Trump ignored the experts, downplayed the threat COVID-19 posed, and misled the American people — and we’re all paying the price every single day. https://t.co/klaYVm3gpY",fake
@ricci_sergienko All that stuff should be coming online in the next few days. It’s hard to build a hardy ops team for a grueling high-pressure data operation while also building a website. We will have visualizations and other presentations of the data soon though.,real
The #NCDCRRT supported the Kogi State Ministry of Health in a SORMAS training for #COVID19 Disease Surveillance &amp; Notification Officers EOC members &amp; pillar leads. NCDC remains committed to strengthening digital disease data management across states. #TakeResponsibility https://t.co/XspoUh5aUL,real
#IndiaFightsCorona: The number of recovered cases is progressively rising and the total number of recovered cases are now more than 38.59 lakh: Secretary @MoHFW_INDIA #StaySafe #IndiaWillWin https://t.co/9wbsR3TOJq,real
If you have been around someone with #COVID19 someone from the health department may check in with you about your health. If your phone number changes tell your health department &amp; doctor. Learn more: https://t.co/9ZN2zYTaud. https://t.co/HtOhTDbl1p,real
RT @CDCtravel: Looking for #COVID19 risk in a certain destination? Check out CDC’s COVID-19 travel recommendations for each country: https:…,real
The rapid diagnostic tests for coronavirus are being manipulated to show more coronavirus infections.,fake
"A chain message circulating through various social media communities in Buenaventura (Valle del Cauca Colombia) claims that the city's mayor Víctor Hugo Vidal received “the first complaint from the Office of the Attorney General for poor performance of functions (sic)” facing COVID-19. There was a ""lack of authority and public administration"" says the publication.",fake
Parents: You may have questions about how your child will return to school this fall during the #COVID19 pandemic. A new decision-making tool is available to help keep your family safe and prepare for the upcoming school year. Learn more: https://t.co/z3oVIHBirZ. https://t.co/KxZCRvGh5y,real
Florida also reported a record number of cases today—close to 10k. Florida remains one of the few states that does not report how many people are currently hospitalized. https://t.co/1k6DhZBtew,real
“We’re down near the low end of per capita deaths ... Most places are at 60 deaths per 100000. We're at 29.”,fake
#IndiaFightsCorona With high number of sustained recoveries India surges ahead with highest single day RECOVERY. Nearly 75000 discharged in the last 24 hours. #COVID19 https://t.co/hd9qPQZj3o,real
A further 3105 #COVID19 cases have been confirmed in the UK - and the number seems to be rising rapidly having ticked over 1000 only a few weeks ago Sky's Ed Conway writes https://t.co/KEiW4kl4Gj,real
Three stories this morning: 🔴PM considers new #coronavirus measures as London mayor insists we should not wait https://t.co/03VMOIRyDk 🔴European countries impose new restrictions https://t.co/p8rOOxvSVg 🔴US Supreme Court judge Ruth Bader Ginsburg dies https://t.co/yGneR3ZnPO https://t.co/mo49aAx1BU,real
@shaskell12 @alexismadrigal That’s what I mean though: the system clearly does not have this capacity even if the machines technically do. It’s like having tanks and no fuel or supply lines. Necessary! Not good at winning a war. -@alexismadrigal,real
"@rajesha_rao @friddlecopper @fireAnd_Bloodd @TheDailyMao Sir watch the reality behind growing gdp during wuhan virus pandemic...i didn't believe over this...video....Naah..because china is limitless..country..
https://t.co/flCnVwXlY5",fake
It will take a “collective willto avoid 300000 #COVID deaths by year’s end. https://t.co/sNnjPDYdWv,real
Trump Assigns Meat Loaf &amp; Gary Busey To Covid-19 Team https://t.co/mxXbADxhhH,fake
Croatian president tells people to buy in bulk for at least 2 weeks.,fake
India records yet another single-day rise in new infections with over 26000 cases inching the country’s total confirmed case tally to eight lakh. Karnataka CM BS Yediyurappa goes in to self-quarantine for the next five days. #coronavirus #coronavirusFacts https://t.co/4oQ5z29NBv,fake
Nashville Man Successfully Treats Coronavirus with Wedge of Lime https://t.co/JtfjPpFWZw #beer #nashville #coronavirus #epidemic #corona,fake
Texas did not report yesterday so their numbers are for 2 days. They’ve also changed their method of counting deaths to a more comprehensive but slower method. Read more about the complex accounting of COVID-19 deaths in our most recent blog post: https://t.co/J8sdFTYlug,real
Clinical trial outcomes of favipiravir in the management of mild to moderate COVID 19. Join the webinar using the below link https://t.co/PjKYWMf4pq @KenyaPhysicians https://t.co/1kvpKK24k7,fake
More detail on this from one of @COVID19Tracking's sharpest observers @jordan_zino from @GavinNewsom's livestream. https://t.co/l2s3AloB28 https://t.co/oZuw8XckHd,real
While the number of daily tests has increased as an integral part of CHASE THE VIRUS strategy States have been advised that all symptomatic negatives of Rapid Antigen Tests are mandatorily subjected to RT-PCR.,real
Federal deputy (equivalent to Federal representative in Brazil) Osmar Terra claims that in Italy lockdown policies made COVID-19 cases shot up.,fake
"A video showing where ""the coronavirus began"" was made in Wuhan.",fake
Coronavirus: Bus passenger uses snake as a face mask https://t.co/aExkX40APq,real
Equitable global access to tests treatments and vaccines is key to ending #COVID19 fairly effectively and efficiently. Because if one of us is at risk we are all at risk. We are only safe when everybody is safe. https://t.co/rihWnivQ0V,real
Sinclair Broadcast Group is delaying airing an interview with a conspiracy theorist who baselessly claims Dr Fauci created the coronavirus https://t.co/RYcTQLNHwS,fake
Hospital ship steers towards disaster relief for coronavirus. https://t.co/VgflHN5Bjl,real
"Temperature, humidity could affect transmission rate of Covid-19",fake
#COVID19 vaccine deals in the works with candidates producers says Union Health Minister @drharshvardhan in an interview with @htdelhi. https://t.co/W74qGNNXOm @PMOIndia @PIB_India @DDNewslive @airnewsalerts @ICMRDELHI @COVIDNewsByMIB @CovidIndiaSeva @mygovindia,real
Pubs bars and restaurants in England will be forced to close at 10pm every night from Thursday - but here are three other sets of measures that Boris Johnson could be set to announce 👇,real
Japanese Nobel laureate Tasuku Honjo who worked in Wuhan for four years claimed that SARS-CoV-2 was human-made.,fake
A total of USD35 billion is still needed for the Access to #COVID19 Tools (ACT) Accelerator to produce 💉2 billion vaccine doses 💊245 million treatments 🧫 500 million tests 👉 https://t.co/fXHNTOsLVR https://t.co/bylBCX1RLR,real
How a healthy 16-year-old boy lost his life to #COVID19 in just 12 days. https://t.co/smQHSWqt56,real
NEWS! Government coronavirus strategy enters the ‘Hope it all sorts itself out’ phase https://t.co/FKlG6ILQB4 https://t.co/mSUaTenV91,fake
Claim: Top Georgian health official Gamkrelidze said the COVID-19 vaccine will be available in Georgia in several weeks,fake
Latest updates from Ministry of Health: For the 17th consecutive day there are no new cases of COVID-19 to report in New Zealand.⁣ ⁣ Our total number of confirmed cases remains at 1154 which is the number we report to the World Health Organization.⁣ https://t.co/V1DO6Ds7Op,real
Our daily update is published. States reported 763k tests and 62k new cases. This is a considerable jump from mid-week which is not typical and may reflect a return to more normal reporting after the east coast weather problems. The death toll was 1333. https://t.co/HpR963c9nQ,real
"Lockdown 2020 Survival Juice

Get your mug HERE &gt;&gt;&gt; https://t.co/c8y1icgbTs https://t.co/vlTolNoL0y",fake
"North Carolina???s health department is ""telling hospitals that if they decide to do elective surgeries, they won???t be eligible to receive (protective equipment) from the state.??�",fake
The South as a whole reported more than 500 new deaths today a new high for the region. https://t.co/nGeLkttQ34,real
As we fight the coronavirus pandemic it is also important to fight the infodemic. Do you know fake news and misinformation can bring disharmony to society? Verify before sharing and don't forget to tell the receiver #MainBhiNewschecker https://t.co/geNbF1EVLc,fake
#IndiaFightsCorona Focussing on timely and aggressive TESTING India has exceeded 3 crore tests. https://t.co/1ayhEzmPF8,real
South Carolina reported 72 new deaths 30 more than the state has ever reported in a day and a very large number for a state that has a quarter of the population of Florida. https://t.co/f2UaRqErdb,real
As of March 25 41 US states and 1 US territory report some community spread of #coronavirus (COVID-19). Of those thirteen states report #COVID19 cases are “widespread.” See CDC’s map to stay up to date on what is happening in your state. https://t.co/MCP09UDSPe https://t.co/a3pt1OtixV,real
Our daily update is published. We’ve now tracked 18.7 million tests up 465k from yesterday the second-highest daily total we've seen. Note that we can only track tests that a state reports. For details see: https://t.co/PZrmH4bl5Y https://t.co/A9iB8cX3XB,real
“Germany and the United States are the two best in deaths per 100000 people which frankly to me that's perhaps the most important number there is.”,fake
The number of currently hospitalized COVID patients in Texas surpassed California today. https://t.co/O4Kqm7zD7V,real
"Delays in getting #coronavirus test results back have been condemned as ""appalling and negligent"" by the chair of a body representing 4000 care homes in the UK https://t.co/24FOp5twxm",real
"Don't open any school or college till the vaccine of covid-19
We know the circumstances of such opening, 
Students are gathering each other and it will share food and playing it will create problem to all India, 
As of now. Many states are opening school,
#schoolsreopening #stop",fake
Americans Attempting to Speak Truth to Power Hindered by State-Mandated Face Masks https://t.co/v7zFbr9Ud4 #covid19 #pandemic #freedom,fake
One confounding data issue right now: New York City is reporting confirmed and presumptive deaths but the state is not so we are not. However at least one state (Ohio) is lumping those numbers together. This may get messy in the coming days.,real
"#bioweapon news:
Another scary thing about COVID: Survivors aren’t fully recovering - https://t.co/TtOcbbWtmP https://t.co/ciUBtYNZ5x #SmartNews",fake
Acc to @MoHFW_INDIA #COVID19 #RecoveryRate and #FatalityRate are 74.30% and 1.89% respectively as on 21st August 2020 (till 6PM). #COVID__19 #COVID #COVID_19 #COVIDー19 #COVIDUpdates #CoronaUpdates #Corona #coronavirus #CoronavirusIndia #CoronavirusUpdates #CoronavirusPandemic https://t.co/e2gZ5Er1BZ,real
The cloth face coverings recommended to slow spread of #COVID19 are not surgical masks or N-95 respirators. Those critical supplies must continue to be reserved for healthcare workers and other medical first responders as recommended by current CDC guidance.,real
"The United States is ""recruiting"" doctors to confront COVID-19.",fake
CDC offers technical assistance &amp; resources to help inform state &amp; local school systems as they work with health officials to make community-based decisions on opening K-12 schools during the #COVID19 pandemic. https://t.co/cqJOW6vrmf https://t.co/cLk837dK89,real
There's a lot of interest in Georgia. Their testing numbers are way down since May 27 when they pulled antibody tests out. But that doesn't seem like a full explanation. As the tests have swung down cases have been steady so the positive rate has shot up. https://t.co/Jn7UNgnCRp,real
Widely available steroid reduced COVID-19 deaths by up to one third in severely ill patients study shows https://t.co/nLqNvRfGVb,fake
"Thankful to Montana business leaders stepping up to keep us safe. ""If strict stay-at-home protocols are followed for the next three months the model shows a peak June 15 with 59 hospitalizations."" via @DailyInterLake https://t.co/ayFKe7keT0",real
• We still have 16 significant clusters four of which are now closed. ⁣ ⁣ • Yesterday our laboratories processed 5961 tests bringing the total number of tests completed to date to 203045 - just over 4% of New Zealanders.⁣,real
“The idea is to get ahead of the problem.” Professor in global public health Dr Devi Sridhar explains why new restrictions have been introduced to stop separate households meeting indoors in Scotland. Get more on the new restrictions: https://t.co/vldZFRNEAj https://t.co/yLIsgyNTQv,real
NEWS! Boris Johnson ends lockdown with immediate effect after first full night spent with screaming baby https://t.co/8IHiRZSqGE https://t.co/hVEfZUdJLH,fake
Coronavirus ‘still not as stressful as explaining Windows 10 upgrade to your parents’ https://t.co/c6JiLnWADx,fake
