tweet,label
"COVID-19 virus will be killed at a temperature of 30-35 degrees. Therefore, drink more hot water, go under the sun for a long time",fake
When a police officer enforced lockdown orders on people in a temple in India he was beaten up there.,fake
Standby we've got a little bug to squash on the daily numbers.,real
"WHO warned that the second wave of the pandemic would be ""catastrophic"".",fake
"Unless we become as aggressive in fighting casteism as we are against Corona, we are doomed. https://t.co/JEzDCaVqC6",fake
"Prattle Maddow! Prattle! What you should be telling your viewers about COVID, is the lesson learned from Africa. A continent of more than 1b, only 30k COVID deaths? Reason, most Africans already take Chloroquine as antimalarial prophylactic. Works the same for COVID. https://t.co/Ao6Wqf4pcw",fake
Update on MIQ numbers: There are currently 5423 people in managed isolation and quarantine. Our current effective capacity is 7091. This gives us an excess capacity of 1668. Over the next week we are projecting 2816 arrivals and 2560 departures from our facilities.,real
Wash your paws - Washing your paws is recommended by Dr Fucini for getting rid of COVID-19 at PETA's request.,fake
"Says the governors of Michigan, New York and Nevada ???have issued orders banning the prescription of hydroxychloroquine to patients with COVID-19.??�",fake
The cases of COVID-19 the disease caused by the novel coronavirus is not real and was planned by US billionaire Bill Gates to push the use of vaccines and microchip implants.,fake
The success of the COVAX Facility hinges not only on countries signing up to it but also filling key funding gaps for both the research and development work and to support lower-income economies within the facility.-@DrTedros #COVID19,real
Nationally more than 44k new cases were reported today. That's the third straight record day. https://t.co/ahY6WvRLC6,real
Yesterday our laboratories processed 2125 tests bringing the total number of tests completed to date to 496606. There were 1134 swabs taken in managed isolation and quarantine facilities yesterday.,real
for cure.. Review of @ICMRDELHI Lab Surveillance Data indicated that after initial #RTPCR positive results #COVID19 cases became negative after a median duration of 10 days. Recent studies also suggested that viral load peaks in the pre-symptomatic period (2 days before).. (2/4),real
A blog article claiming that according to the European Parliament 5G accelerates the COVID-19 pandemic.,fake
_China has successfully developed a vaccine ready to combat the coronavirus._,fake
Studies on children transmitting COVID-19 to other people is infrequent. But that could be because school closures reduced the opportunities for children to become infected.,fake
The last places free of #COVID19 are in the Pacific. Here’s how WHO helped countries in the region step up their efforts to prepare for the arrival of COVID-19👉https://t.co/jgwGoj6z8b #WHOImpact https://t.co/xsBv8DwGxS,real
Harvard scientist predicts coronavirus will infect up to 70 percent of humanity https://t.co/03HGuvCatU https://t.co/03HGuvCatU,fake
"“60 days into the coronavirus crisis, the White House does not have a plan, a framework, a philosophy, or a goal.”

Real presidents lead. Reality TV presidents don’t. https://t.co/hn7GkkPv5Y",fake
Mine Phone Sayardaw predicted that COVID-19 infections could exceed 100 million worldwide.,fake
Justice Secretary @RobertBuckland says children in school and their parents should be prioritised for #COVID19 testing after the NHS and social care #KayBurley Read the latest here: https://t.co/nXB33tzr7s https://t.co/mSa3NPiaHc,real
Testing is conducted for 3 categories of people presenting with #COVID19 symptoms 1. Contacts of confirmed cases 2. Residents in areas of moderate-high prevalence of COVID-19 3. Recent returnees Learn more about #COVID19Nigeria testing &amp; share! #TakeResponsibility https://t.co/6nHwDofneH,real
An update on the two cases on 16 June: We’ve cast the net very wide. We’re following up 401 people none of which are considered close contacts. The only close contact is the father of the women. We have 174 who have returned negative results the other results are pending. ⁣,real
Today’s first case is the young child of the couple announced yesterday as cases who have recently arrived from India. We are pleased to report that all family members are doing well at the Jet Park Hotel the quarantine facility in Auckland. The child is under two years old.⁣,real
@pantherman45 Thanks Ben! 🙌 we're at Alert Level 2 at the moment so most New Zealanders will have returned to some form of normal. Cabinet meets tomorrow to decide on when we move to Alert Level 1.,real
A Hairstylist in Iowa Exposes 317 Clients To The Coronavirus https://t.co/j2JxcK1exb #coronavirus #hairstylist #placebopills,fake
Face masks will become compulsory for bar staff shop workers waiters and taxi drivers in an effort to combat the rise in coronavirus cases in England the prime minister has announced https://t.co/RkZ60kRuul,real
"“65 people in Ahmedabad tested positive, 11 in Kanpur and 8 in Lucknow after being exposed to vegetable infected with coronavirus”",fake
A curfew could be introduced across London to help prevent a second wave of #coronavirus according to a public health director https://t.co/nHnxomEOtN,real
Our daily update is published. States reported 712k tests and 51k cases along with 616 deaths. We’ve seen for months that the Saturday-Monday numbers tend to be lower than Tuesday-Friday. But compared with last Sunday cases and deaths are both up. https://t.co/A8b43GC3KW,real
There are two cases considered to have recovered from COVID-19 which brings the total number of active cases to 24.,real
With 10576 new infections Maharashtra records highest single-day spike in the state so far. Starting 2pm tomorrow Manipur to go under a complete lockdown for 14 days. Bhopal in Madhya Pradesh to impose a city-wide lockdown from July 24 to August 3. #COVID19 #coronavirusFacts https://t.co/6U1006Zp1P,fake
The number of people going hungry is ↗️ and #COVID19 is making things worse 📈 The #SOFI2020 published today estimates that approximately 690 million people went hungry in 2019. 👉 https://t.co/2I65kfSVz0 https://t.co/Db53c4tNwB,real
Of the 25 new cases reported 1 case was inadvertently reported from Osun state. This case was from OYO STATE The correct breakdown is as follows: Lagos- 11 Osun- 6 FCT- 3 Edo- 3 Ondo- 1 Oyo- 1,real
RT @PIB_India: Highlights of the week ✅Over 4.5 crore samples tested so far ✅Over 1.1 million tests done in the last 24 hours ✅Over 29 lak…,real
There are no additional deaths to report.⁣ ⁣ Yesterday our laboratories processed 7287 tests bringing the total number of tests completed to date to 190326.⁣ ⁣ Full update: https://t.co/pgOnuXVUUc,real
Sometimes these people seek testing because they have a respiratory illness &amp; it seems that an acute non-COVID respiratory illness then creates the condition where a residual COVID-19 virus is detected. Over the past two months we have seen four different examples of this.,real
@drharshvardhan dispels doubts raised over failure of one vaccine in clinical trials says trials are continuing only after expert committee reappraisal. “No significant mutation in SARS-CoV-2 in India”. “ICMR is actively exploring saliva-based test for COVID-19”. @PIB_India,real
The COVAX Facility: -enables governments to spread the risk of vaccine development &amp; ensure their populations can have early access to effective vaccines -is the mechanism that will enable a globally-coordinated rollout for the greatest possible impact-@DrTedros #COVID19 #UNGA,real
It could take years to recover from the backlog of surgery in the NHS caused by the COVID-19. https://t.co/G3BnfmYotN,real
NICE will not be approving encorafenib + cetuximab for treating BRAF V600E mCRC. https://t.co/hO7YpJlLun,real
WHO @eu_echo @Canada &amp; @DFID_UK joined forces to support Belize 🇧🇿 in improving its diagnostic &amp; training capacity and providing crucial equipment &amp; supplies during #COVID19. 👉https://t.co/GjisuK6g4w #WHOImpact https://t.co/vipc38ReWZ,real
"9/10 New lockdown restrictions should come into force in London according to the Mayor of London. Sadiq Khan said he had met with officials across the capital to ""agree a new London plan"". Click below 👇 to see what measures the mayor is calling for https://t.co/XA7OumRlCc",real
Today there are three people in hospital with COVID-19 – one is in isolation on a ward in Auckland City Hospital. Two are in ICU at North Shore and Waikato hospitals. ​ ​ Our total number of confirmed cases of COVID-19 is now 1446 which is the number we report to the WHO,real
The nasal swab test for COVID-19 damages the “blood-brain barrier” and can lead to brain infections.,fake
The disaster management act in India prohibits posting messages regarding COVID-19 and would attract punishment to those who don't obey.,fake
People are panicked about a COVID-19 case at the Dakar Airport.,fake
#COVID19 seems to spread more easily between people in close quarters such as ships. US @StateDept recommends all travelers especially those who are older or have underlying health issues defer all #cruise ship travel worldwide. https://t.co/17jMJBxJxU https://t.co/K6nZjHWJGj,real
As Govt. of #Jarkhand has extended the Lockdown till 31 July 2020 kindly contact the State Helpline for clarification: 0651-2490104 / 2490125 / 2490127 / 2490128 #COVID19 #COVID #Covid_19 #COVIDー19 #CoronaUpdates #CoronavirusIndia #CoronaVirusUpdates #coronavirus #COVIDUpdates https://t.co/w6SEJJhbI6,real
It's important to recognize that death data lags in some cases more than 10 days. And given how long COVID-19 takes to kill people these low death numbers are probably a reflection of the infections that occurred 3-4-5 weeks ago (i.e. mid-to-late April).,real
Our daily update is published. States reported 1.1 million tests 44k cases and 737 deaths. This is the first time we've seen more than 1 million tests reported. https://t.co/wx85TR8WcE,real
_A photo shared hundreds of times on Facebook claims to show the American cable news channel CNN describing cases of COVID-19 in Nigeria as ???false??� accusing the government of making them up to embezzle public funds._,fake
Authorities from the Guatemalan Ministry of Health said they would buy at least 200 respirators but there has been talk of a shortage of this type of medical equipment.,fake
If you‘re sick with #COVID19 &amp; your pet becomes sick don’t take your pet to the veterinary clinic yourself. Call your veterinarian &amp; let them know you have been sick with COVID-19. https://t.co/H8NS2GTd4x https://t.co/YGwd8QiHpx,real
Video of people of Italy saying goodbye to the world by standing outside a masjid in Milan as they couldn't control the spread of COVID-19 (SARS-COV-2) virus.,fake
Because of a WHO clause Dutch primary schools are allowed to vaccinate children without their parents' consent.,fake
NEWS! Parliament and other non-essential activities to reopen in June https://t.co/zIInu3zEa3 https://t.co/a7juGCR2qz,fake
Flu shots can make someone test positive for COVID-19.,fake
#IndiaFightsCorona: UPDATES on #COVID19 India sees an unprecedented surge in Recoveries Nearly 75000 recoveries in last 24 hours Total number of Recovered Cases nearly 34 lakh #StaySafe #IndiaWillWin https://t.co/CXIg9xTt68,real
There is no one in NZ receiving hospital level care for COVID-19. ​ ​ Yesterday our laboratories completed 2575 tests bringing the total number of tests completed to 424719. The Minister is advised &amp; reassured that these numbers will continue to increase over the coming days.,real
"A lot of that engagement appears to have been driven by Brian Rose and his organization London Real which is behind the website that hosted ""Plandemic 2"" and has a history of airing falsehoods about COVID-19.",fake
443 new cases of #COVID19Nigeria; Plateau-103 Lagos-70 FCT-60 Ondo-35 Edo-27 Rivers-27 Kaduna-20 Osun-19 Borno-18 Oyo-18 Kwara-11 Adamawa-9 Nasarawa-7 Gombe-6 Bayelsa-4 Imo-4 Bauchi-2 Ogun-2 Kano-1 45687 confirmed 32637 discharged 936 deaths https://t.co/X2pZRogn59,real
The influenza vaccine Fluzone is more deadly than COVID-19,fake
???More people have died from knowing Hillary??� than coronavirus.,fake
An old man infected 300 people with coronavirus in Jaipur India through tobacco smoke.,fake
"Good News | Active #coronavirus cases in #Delhi drop below 10,000. Every inch taken back is a recovery well earned!!! #GoDelhiites https://t.co/246nGmOdHc",fake
States reported 1121 deaths a small rise from last Tuesday. Southern states reported 640 of those deaths. https://t.co/YASGRTT4ux,real
COVID-19 tests can be purchased to do the test at home with sanitary guarantees.,fake
A volunteer for Coronavac a Chinese vaccine against COVID-19 being tested in Brazil reported severe fevers in a story published by Marie Claire magazine.,fake
@Fmohnigeria has confirmed 10 new cases of #COVID19 in #Nigeria Of the 10 new cases 3 are in the Federal Capital Territory and 7 are in Lagos 9 out of the 10 cases have travel history outside Nigeria in the last one week. The 10th case is a close contact of a confirmed case https://t.co/Bm557clqL0,real
Taiwanese president and former president were infected. The former president died.,fake
There are 68 @ICMRDELHI approved #COVID19 testing labs in #Delhi comprising 23 Govt. Labs &amp; 45 Pvt. Labs. Kindly refer to the following link for the list of labs: https://t.co/OopNgTuKxQ #COVID__19 #COVID #COVID_19 #COVIDー19 #COVID19India #Corona #coronavirus #CoronavirusIndia https://t.co/iw2ifKTGg6,real
Most of you know this by now but there is a very strong weekend effect that hits on Sundays and Mondays especially in the reporting of COVID-19 deaths. Sundays are highlighted in red below. https://t.co/fpaDhxolj0,real
"I can't hit the campaign trail in-person due to COVID-19 — so instead, I’m traveling across the country from my home in Delaware. Head over to my Instagram to catch up on today’s trip to Florida 📲.",fake
"They won't and they can't. Many missionaries have died in corona. Even Mother Teresa died a painful death. If Jesus could bring health, Christian hospitals would not be having operation theatres and surgeries. https://t.co/TgTtECOkp5",fake
RT @CDCDirector: Remember to practice every day #foodsafety during #COVID19. Put away foods that could spoil such as meats milk &amp; eggs…,real
“Clearly the Obama administration did not leave any kind of game plan for something like this.”,fake
Image shows long queue of buses of migrants that were denied permission to enter Uttar Pradesh by the state government.,fake
Quotes Sen. Lindsey Graham as saying President Trump ???probably knows more about medicine and specifically viruses than any of the so-called scientists at the NIH and CDC.??�,fake
Before our update we wanted to show you why we do this. Tracking testing data in the U.S. has been a challenge. The CDC is currently publishing incomplete data that lags several days behind state reports. We collect and clean the state data. Here’s how the two datasets differ: https://t.co/Eu8pbiZ5Rf,real
#PublicHealthReports has announced a Call for Papers on #COVID19 inviting #publichealth practitioners and academic researchers to share challenges lessons learned and opportunities for public health practice. Learn more here: https://t.co/mhm9gxCn3o. https://t.co/HTQkvIkTK5,real
#Vermont is currently the only state on track to contain COVID. Cases are steadily decreasing and Vermont’s COVID preparedness meets or exceeds international standards. https://t.co/yYdwQVRC2w https://t.co/UJEes6DHc9,real
The (corona)virus just isn't nearly as deadly as we thought it was.,fake
The latest CDC #COVIDView report shows that after decreasing nationally during May and early June the percentage of people testing positive for #COVID19 increased slightly in some parts of the country. Learn more: https://t.co/zP4VYlo0Pb https://t.co/IqqHdI5g5A,real
Shopper Was Wearing Facemask Back-To-Front https://t.co/CucbuqjvVv #shopping #coronavirus #lockdown #facemasks,fake
There are currently 4563 ​ people in managed isolation and quarantine. Our current effective capacity is 7103. This gives us an excess capacity of 2540. Over the next week we are projecting 3343 arrivals and 2047 departures from our facilities.,real
Reopening of places of worship doesn't mean that the #COVID19 outbreak has subsided. Risk remains high If you must gather to worship in the mosque today take preventive measures Maintain a distance of 2m from the next person 😷Wear face a mask #TakeResponsibility https://t.co/NC0XaZY5Pd,real
Nebraska is still 1 of only 3 states not releasing any race or ethnicity information. The others are North Dakota (@ndgov &amp; @DougBurgum) and Nevada (@NVGovernment &amp; @GovSisolak),real
Did you see this #AllEyesOnKentucky post circulating Instagram? For Kentucky's primary this week the number of in-person polling places was cut significantly. But mail balloting and early voting were expanded significantly amid COVID-19: https://t.co/M4HtcOsBhA https://t.co/e7qFPFViFh,fake
Yesterday our laboratories processed 681 tests. The vast majority of these 673 were swabs taken from managed isolation facilities as these are processed promptly.,real
Amid all the chaos and problems caused by COVID-19 there was hope that physicians would get a break on their complicated payment reporting programs. Alas… https://t.co/AVscr9fV9U https://t.co/MpJIH6CjO4,real
_A claim that India???s Ministry of Home Affairs has made it a ???punishable offense??� for citizens to publish posts on social media about the novel coronavirus has been shared repeatedly on Facebook Twitter and WhatsApp._,fake
Our daily update is published. States reported 569k new tests today. For details see: https://t.co/PZrmH4bl5Y https://t.co/sO8yfE2ael,real
New rules banning social gatherings of more than six people have been introduced across England Scotland and Wales. But what are the new rules what happens if you break them and how do they differ across the nations? 👇,real
Nashville Man Becomes Unstoppable After Eating Raw Beet https://t.co/5PiNezqhpk #health #nashville #covid19 #immunity #inflammation,fake
"An ""official"" mask to combat the novel coronavirus was released.",fake
In the last 2 weeks of July 97K U.S. children tested positive for COVID +40%. While some students head back to the classroom other students log on for virtual learning due to new infections among students and teachers. Read more: https://t.co/wsnM1MYoC2,real
Most key indicators used to track #COVID19 such as the percentage of deaths attributed to pneumonia influenza or COVID-19 fell from the prior week. CDC will continue to monitor closely in the coming weeks. See #COVIDView report: https://t.co/zP4VYlo0Pb https://t.co/70kcRQSKUz,real
RT @WHO: The decline in vaccination is due to disruptions in the delivery and uptake of immunization services caused by the #COVID19 pandem…,real
Kenyan President Uhuru gives artists Sh 2 billion as a cushion due to COVID-19 job losses.,fake
PM Forced To Act On Coronavirus After Learning His Voter Base Might Not Exist In A Few Months: https://t.co/fhIYxGiYHG https://t.co/e2QjQOwpsr,fake
"You heard it straight from the president himself: He wants to terminate health care for millions of Americans in the middle of a global pandemic.

We can't let that happen. https://t.co/OD1rdn8yiz",fake
A May 13 study in The Proceedings of the National Academy of Sciences shows that talking can produce thousands of saliva droplets that stay in the air for up to 14 minutes. https://t.co/Ns1dm0IYRi,real
Managed isolation in NZ: New Zealand is safely welcoming Kiwis home while keeping our communities protected from COVID-19. All people arriving in NZ must stay in a managed isolation or quarantine facility for at least 14 days &amp; test negative for COVID-19 before returning home. https://t.co/0oEcVTUvcD,real
RT @HarvardGH: Contact tracing testing and supported isolation (TTSI) across the nation will provide pandemic safety and get the US back o…,real
Sisi Raised The Numbers of coronavirus Cases in Egypt in the Hope of Billions from the World Bank.,fake
Viral video of Zee News staff member assaulting doctor refusing to get tested. Can we share this like a few thousand times before checking for authenticity like news channels do.,fake
As of June 29 forecasts suggest 11 states are likely to report more #COVID19 deaths in the next 4 weeks than the previous 4 weeks. Nationally between 140000 and 160000 total deaths are expected by July 24: https://t.co/Ft6cgmaMPX https://t.co/ojzFd3UhIB,real
Georgia Gov. Brian Kemp ???mandates restaurants reopen??�,fake
Wuhan Property Prices Take A Dive https://t.co/t74vFTKOFB #china #coronavirus #property #wuhan,fake
"@BaileInis @SuzanneEvans1 @MattHancock Yes, why would a safe, cheap medication be refused by the authorities. To my knowledge, chloroquine and hydroxychloroquine have never been available OTC, even before Covid.",fake
Camila Cabello’s Coronavirus Advice On Instagram Is Something We All Should Keep In Mind https://t.co/RAiPIKPyRr,fake
"Old drug, new tricks? Fish tank additive may treat coronavirus",fake
"A Facebook post that claims that the COVID-19 is a ""fraud"" because the mass media used the same photo of a portuguese boy in multiple stories about children who died from COVID-19.",fake
No deaths have been reported in Israel due to COVID-19 because they have found a cure for the disease. A solution of hot water baking soda and lemon is the cure for COVID-19.,fake
There is no one in New Zealand receiving hospital-level care for COVID-19.​ ​ The total number of confirmed cases of COVID-19 is now 1206 which is the number we report to the World Health Organization.,real
Acc to @BiharHealthDept as of 24 July 2020 a total of 429664 samples have been tested for #COVID19 of which 10456 #COVID_19 tests were conducted yesterday. #Bihar #Covid__19 #COVIDー19 #CoronaUpdates #CoronavirusIndia #CoronaVirusUpdates #coronavirus #COVIDUpdates https://t.co/9eoAVk1wbD,real
Female COVID patients may produce more antibodies against the virus than male patients do according to a peer-reviewed study from the Journal of Medical Virology. The study potentially explains why females generally have less severe symptoms: https://t.co/CWoD7FinPD #covidstudy,real
The latest CDC #COVIDView report shows the percentage of deaths attributed to #COVID19 increased during the first 3 weeks of July but has since been on the decline: https://t.co/zP4VYlo0Pb. https://t.co/C9Eu0ARcJ3,real
NSCI badminton court!!! Who is keeping a eye on all this or Night life is still on ??,fake
A case of coronavirus was confirmed in Cali in Colombia and a video shows doctors treating patients in a bus station.,fake
By known positive tests the 10 states with the highest per capita number of cases are: Washington New York Colorado Massachusetts Louisiana Rhode Island New Jersey South Dakota New Hampshire Georgia,real
Underlying conditions like diabetes mean greater risk for getting or transmitting COVID-19 within the home finds a CDC study. Learn more: https://t.co/pN20Dpfd22 https://t.co/3N1Ju9vO3K,real
5 pictures show people who were alledegedly infected with Staphylococcus bacteria because of masks during the pandemic,fake
Many COVID-19 treatments may be associated with adverse skin reactions and should be considered in a differential diagnosis new report says. https://t.co/GLSeYX2VDq,real
The Most Presidential Of Drugs https://t.co/CYmxDfq661 #donaldtrump #america #coronavirus #medical #cure,fake
•​There’s been great support from churches and faith based organisations from Alert Levels 4 through 2.​ We understand how important it is to practise faith. The limit on gatherings is currently 10 this applies to public and private gatherings. This will be reviewed 25 May.,real
#IndiaFightsCorona: There are 14 States/UTs in the country where the total number of active cases are still less than 5000 : Secretary @MoHFW_INDIA #StaySafe #IndiaWillWin @ICMRDELHI https://t.co/cdvR7I8Nze,real
However only 14% of countries reported removing user fees which WHO recommends to offset potential financial difficulties for patients.-@DrTedros #COVID19 https://t.co/rzBwdJ0fZd,real
People violate social distancing protocol in a temple festival in Alappuzha India.,fake
"Labour's @GrahameMorris calls for a targeted expansion of the #COVID19 job retention scheme warning of ""a tsunami of job losses"". The PM says the govt is looking at a ""massive package"" of investment in jobs including its £2bn Kickstart fund. #PMQs https://t.co/7TVjTmyCxc https://t.co/MQKjpzQzv8",real
Such an approach has started showing results and recoveries are also increasing exponentially.,real
386 new cases of #COVID19Nigeria; FCT-130 Lagos-65 Ondo-37 Osun-29 Plateau-23 Rivers-15 Enugu-14 Nasarawa-12 Bayelsa-11 Ebonyi-11 Ekiti-9 Oyo-8 Edo-8 Abia-6 Ogun-3 Katsina-3 Imo-1 Adamawa-1 43537 confirmed 20087 discharged 883 deaths https://t.co/JfacBBoawd,real
We still have 16 significant clusters four of which are now closed. The number of cases linked to the Ruby Princess cruise ship increases by 1 due to the linking of an existing case.,real
A message on WhatsApp claims steam inhalation cures COVID-19.,fake
NEWS! Scientists urged to divert attention away from Coronavirus vaccine to create pillow that stays cool all night https://t.co/jdWna3eDDy https://t.co/RIwHG0YMBH,fake
"*WORLD HEALTH ORGANISATION PROTOCOL&amp;PROCEDURE OF LOCKDOWN PERIODS FOR CONTROLLING ON MOST DANGEROUS VIRUS*

STEP 1 - 1 DAY.
STEP 2- 21 DAYS.
AFTER 5 DAYS.
STEP 3- 28 DAYS.
AFTER 5 DAYS.
STEP 4 - 15 DAYS.",fake
