tweet,label
"Russia to Supply Anti-COVID Avifavir to 17 Countries.

Based on the Japanese drug Favipiravir several countries developed Covid drugs, like the Japanese Avigan and US/Chinese Remdesivir the Russian Avifavir.

Post-registration clinical trials are complete. https://t.co/mxW1MgJb0I",fake
Man beaten in Deoria India in lockdown time.,fake
Stoner Strung Out To Fuck Thanks To Lockdown Restrictions https://t.co/0h81pytNX9,fake
"_Claim that there have been tanks in the capital of Latvia Riga ""while people are staying home.""_",fake
"@Aball001Andrea @kylegriffin1 @MarkedByCovid Why does he continue to ignore experts and downplay the virus? Why does his cult continue go along with it, despite the evidence? The answer lies in psychology. Experts accurately predicted how he'd react in a real crisis. MSM shut them out. This book was published in 2017. https://t.co/YyckUgsd6G",fake
"BREAKING! After Donald Trump says you need to ""read the books"" about Coronavirus testing to properly understand the numbers, the White House reveals which book in particular https://t.co/NuO7Hv4FMF",fake
We just announced an expansion of our agreement with @BARDA for up to an additional $472 million to support our late stage clinical development of mRNA-1273 including the execution of a 30000 participant Phase 3 study in the U.S. Read more: https://t.co/g9r7aXtguI https://t.co/5bhmfEkQ5t,real
"A friend of mine checked the back of her Clorox wipes and, what do you know, the human coronavirus is listed among the things that these wipes kill. I checked our wipes and, sure enough, it is listed. So my take is, as I suspected, this is no “NEW VIRUS” as the news media wants us to believe.",fake
As per #Delhi Govt. all #asymptomatic passengers who enter/de-board in NCT of Delhi shall #HomeQuarantine for 7 days. You may contact the State Helpline for assistance: 011 22391014 / 22302441 / 22307133 / 22304568 / 22307745 / 22307135 / 22307145 / 22300012 / 22300036 / 22301028 https://t.co/1Q6OsCORpE,real
Zombie Preparedness and a Defense of the CDC’s COVID-19 Response https://t.co/tVss99Bv5f #zombies #covid19 #cdc #facemasks,fake
"The Brazilian Ministry of Health forbade the expression ""COVID-19 suspect"" to be used on death certificates.",fake
Coronavirus: BoE warns recent case increases could hold back economy https://t.co/pMRkLhCYHy,real
A correction. Missouri recently changed the way they reported cases. We followed their change but mistakenly used the older method today which initially made it seem like the state had more cases. We regret the error.,real
RT @US_FDA: If you’ve fully recovered from #COVID19 you may be able to donate plasma to help others. You must have complete resolution of…,real
Depending on progress made the committee may present an interim progress report to the resumed #WHA73 in November and a final report to the #WHA74 in May next year-@DrTedros,real
"NEWS! Deadly Coronavirus nothing to do with piss-poor bottled lager, drinkers reassured https://t.co/qbpfiUpjkI https://t.co/yRXdc9ga2f",fake
The daily press briefing by @PTFCOVID19 is ongoing. PTF Coordinator Boss Mustapha announced a new 300 bed isolation facility in Abuja driven by the private sector. Tune to @NTANewsNow for latest updates on #COVID19Nigeria. Livestream https://t.co/AsBUTswloe https://t.co/6EN2HMz09a,real
Well that's a first we had a bad number in the lead tweet today apologies. Be right back with a corrected death figure—should be 242 not 158.,real
#IndiaFightsCorona With sharply falling CASE FATALITY RATE below 2% India has one of the lowest #COVID19 mortality globally. https://t.co/fTAXNhm9el,real
"They’re going to have vaccines, I think, relatively soon.",fake
"Analysis: Are quarantined passengers adequately protected from Cornwall? #coronavirus
https://t.co/q9kK0HXNeC https://t.co/UPDj4OPxL0",fake
_A video of a woman reciting Sanskrit verses has been viewed thousands of times on Facebook and Twitter alongside a claim that she was delivering sacred verses on a Spanish radio station during the novel coronavirus pandemic._,fake
"‘I lost my job because of coronavirus’, says man fired for sexual harassment and daytime drinking https://t.co/lzsUskmJF5",fake
"Look at what Muslims do after the prayers, as they gathered in hundreds,
Police had to run away as they started stone pelting ... in defiance : 
Should Police use more force if they don’t obey local curfew orders? 
Police in India does not enforce with guns or other means besides lathi (
cane) charge ! Live and let live rule :
🙏🙏🙏",fake
Parcels from China can spread Covid-19,fake
We generated as complete a report as could comparing the CDC data with the numbers we compile from the states themselves. https://t.co/euC0pIKyXH,real
In Kerala India Consumerfed starts 24 hours free home delivery for liquor.,fake
Corona-Corner: Your Questions Answered https://t.co/VsFM1536O7 #covid19,fake
• Travel will be allowed again. Go and see your mum but don’t turn it into a big family reunion when you get there. • For now we are in Level 3 for just two more days when we wake up on Thursday remember: Play it safe and protect the wall of defence we have created.,real
Deaths—1564 yesterday—were pretty close to the average April daily deaths of ~1500 but lower than recent days. Note: we saw a big dip Sun/Mon last week (4/5-4/6) before jumping to a new plateau. https://t.co/p0GUuAqdNN,real
The latest CDC #COVIDView report shows that after declining for several weeks the percentage of people testing positive nationally for #COVID19 increased slightly compared to last week. CDC will continue to monitor this indicator: https://t.co/zP4VYlo0Pb https://t.co/jF4Dwzvi8q,real
FBI serves warrant on senator Richard Burr in investigation of stock sales linked to coronavirus #burrgate https://t.co/wCfLV3xB8H,fake
People in Scotland have been banned from visiting other households indoors in tough new restrictions that go further than those announced for England. Get more on the new measures in Scotland here: https://t.co/n1IFrUg5Jw https://t.co/rpYXGp7f9U,real
The UK has a plan for reopening schools. https://t.co/ff2CLKj75P https://t.co/ppNwjh5xmw,real
"Man Had Beef, Peppers And Onions With Rice For His Tea https://t.co/Cv7IlS87sI #food #coronavirus #foodshortages",fake
Did you know? Breathing in #wildfire smoke can cause symptoms similar to #COVID19 like dry cough sore throat and trouble breathing. Learn how to tell the difference: https://t.co/2xlF9MccFt. https://t.co/htKcD8wgpt,real
Other states seem to be having trouble with several showing substantial drops in current hospitalizations but not posting HHS notices. We’re reporting their hospitalization figures as published and hope to see smoother data next week.,real
Political leader from Andra Pradesh made a nurse touch his feet: Image.,fake
.@CDCMMWR report looking at almost 600 hospitalized pregnant women with #COVID19 found that pregnant women can have severe illness and poor birth outcomes such as the mother requiring intensive care pregnancy loss and preterm birth. Learn more: https://t.co/g7WsFWJdDs. https://t.co/Ve0dnGNTDM,real
“This is not the moment for half-measures (...) History won’t forgive us for waiting an hour more.” The Bay Area was able to #FlattenTheCurve. If we hope to keep the rest of the country safe we must follow their lead and continue to #StayAtHome https://t.co/SRruh7L26K,real
An image of an elderly Italian man who was asked to pay for the ventilator that he used for his recovery.,fake
Two cases reported yesterday from Kaduna were repeat tests. Therefore Kaduna has a total of 114 confirmed cases We apologise to @contactkdsg and remain committed to ensuring the release of accurate &amp; reliable data Breakdown of cases by state: https://t.co/Z5x7UFXpXd,real
According to @MoHFW_INDIA guidelines on preventive measures to contain the spread of #COVID19 in a workplace setting there is no need to close entire office building/halt work in other areas of the office &amp; work can be resumed after disinfection as per laid down protocol. (1/4) https://t.co/U1oFvMgs9Q,real
Since 4/4/20 Italy hasn't registered any new cases of the coronavirus.,fake
A video shows healthcare professionals in a hospital displaying hopeful message. The caption states the video was filmed at Moinhos de Vento Hospital in Porto Alegre Brazil and that they managed to cure all the COVID-19 patients in their ICU and were thus celebrating.,fake
There is a COVID-19 case in Ethiopia.,fake
"""Here’s the problem -- we are testing people for any strain of a coronavirus -- not specifically for COVID-19. There are no reliable tests for a specific COVID-19 virus.""",fake
“The second confirmed case of #COVID19 in Nigeria was detected due to the diligence of our work We advice #Nigerians not to panic or spread unverified information We will continue to keep #Nigerians informed on the #COVID19 situation as it evolves” ~ @Chikwe_I on @channelstv https://t.co/AkXMWnQRMx,real
Quarantined man celebrates St Patrick’s Day by doing keg stand alone in his living room https://t.co/PdDp2E7Zwi #StPatricksDay #covid2019 #lockdownontario https://t.co/IJHmpJBO2E,fake
Coronavirus: Grandparents exempt from local lockdown rules for childcare reasons https://t.co/7naNoVjFVG,real
The government has come under pressure over a lack of availability of #COVID19 tests. Read more here: https://t.co/lMM9qgEryL https://t.co/KjwsinY5s1,real
#IndiaFightsCorona Unprecedented upsurge in #COVID19 testing. India touches a new peak of 4 cr tests. @PMOIndia @drharshvardhan @AshwiniKChoubey @PIB_India @DDNewslive @airnewsalerts @COVIDNewsByMIB @CovidIndiaSeva @ICMRDELHI @mygovindia https://t.co/paYcOXD9ST,real
#IndiaFightsCorona Nearly 57% of the new cases are reported from 5 States. They have also contributed 58% of the new Recovered Cases. https://t.co/BKEXwNG96e,real
Residents of York are asked what they think of a new government rule which allows people in England who may have #COVID19 to be fined up to £10000 if they fail to self-isolate. To read more click here: https://t.co/pqD1I8xgam https://t.co/QPgh3xlDIo,real
"The Japanese government has been refusing to use and introduce a gene test kit manufacturered by Swiss-based pharmaceutical company Roche which is currently in use around the world due to its convenience of use. This is believed to be because the Ministry of Health has already allocated the budget to public project set up to develop their own new tests. If we had used the Roche test kits since day one we could have prevented the outbreak on the cruise ship.""",fake
As per @MoHFW_INDIA's #COVID19 Clinical Management Protocol fatigue &amp; Myalgia (muscle pain) has been reported as a symptom of #COVID: https://t.co/HtiPH32yBo #COVID__19 #COVID #COVID_19 #COVIDー19 #COVID19India #Corona #coronavirus #CoronavirusIndia #CoronavirusPandemic https://t.co/Ih0W4v7ce6,real
There may be 10x as much coronavirus in the US than reported. https://t.co/PCIVYVlZ1B https://t.co/Hk3FCTqqkB,real
"#mother is sitting on a link between two train bogies traveling in a very dangerous manner. Migrant workers are facing greater difficulties than anyone with the #Lockdown4 announced to prevent the spread of the #COVID19.My mind is wandering, so govt should take instant measures.",fake
As we celebrate #EidAlAdha remember to limit the spread of #COVID19 around you; ✅Avoid sharing personal items ✅Wear a face mask ✅Observe physical distancing ✅Wash your hands often ✅Sneeze/cough into bent elbow Let's celebrate Sallah safely. #TakeResponsibility https://t.co/TLUa5u9Q69,real
No despite dip in death rate which is likely to rise again CDC is not about to stop calling COVID-19 an epidemic https://t.co/gn9V7gBxIa,fake
_The novel coronavirus has been artificially created in a laboratory._,fake
Chinese government is burning down people infected with Coronavirus.,fake
Grim milestone marks an increase of 10000 deaths in 9 days. https://t.co/seM7eTf6Qu #coronavirus https://t.co/TPD86DlE42,real
Reports that a curfew could be imposed in London to combat COVID-19 were not denied by Downing Street today. Follow #coronavirus latest updates 👇 https://t.co/NyZLPJPQpk,real
"???President Trump just announced that the ???biological??? lab in Wuhan where the COVID-19 virus was created was ???funded??? by President Barak (sp) Hussein Obama in 2015 to the tune of $3,800,000 American dollars!??�",fake
OK the new site is up: https://t.co/PZrmH4bl5Y Here's a look at the visual evolution. And there's at least this much change under the hood over these last three weeks as we've built the processes to sustain the project over the long term. https://t.co/4Vvop2zFNa,real
ICMR has set up #COVID19 testing labs in Leh at 18000 ft above sea level and there are 1366 labs all across #India. #ICMRFightsCovid19 Visit https://t.co/6PRkBpcxfq for more details. https://t.co/T46mnKxE9c,real
"In AURANGABA, Covid antibody testing in Private lab available now. https://t.co/VPmi4NsmYV",fake
COVID-19 may be linked to an onset of pediatric type 1 diabetes an Imperial College London study suggests. https://t.co/TO7qGLiapG https://t.co/VMwJq4JylX,real
The photos of Ukrainian hospitals show that they are not ready at the end of March to accept patients with COVID-19.,fake
Ministry of Health reminds everyone that if they have any respiratory symptoms they should seek advice from Healthline their GP or after-hours clinic about getting tested. Testing is free. #covid19 #COVIDー19 #COVID19nz,real
More than 1/3 of BAME doctors in the UK are still not being given access to potentially life-saving Covid-19 risk assessments. https://t.co/qsgKFqj5p4,real
"""This is COVID-19, not COVID-1, folks. And so you would think the people charged with the World Health Organization facts and figures would be on top of that.""",fake
And finally the only good chart in the deck. The 7-day average for COVID-19 deaths is now nearly down to 500. For a deeper understanding of these numbers see this post: https://t.co/ZXFERIyS6I https://t.co/DyiKjmUW6S,real
"We are months into this crisis, and Donald Trump still doesn't have a comprehensive plan when it comes to COVID-19 or the economy. It's unacceptable. I released a detailed plan laying out what I would do months ago, and have built on it since. Take a look: https://t.co/xjxsDn2qCD",fake
"To Manage this covid19 pandemic exhaustive distribution of Homoeopathic preventive ""Arsenicum album 30"" #IndiaFightsCorona
@CollectorJamngr https://t.co/7xZr8w1wM2",fake
Coronavirus: Care homes 'widely exposed' as COVID-19 'begins to move in' https://t.co/wjw9Od8KaZ,real
Jedward say they believe coronavirus is “starting to lose some of its power” https://t.co/peoKeGUrq8,fake
???Joe Exotic tests positive for coronavirus in prison. It???s been confirmed.??�,fake
Cumulative hospitalizations tells you something (though far from a complete story) about the severity of the disease. Current hospitalizations measures something else though: it quantifies the strain on the hospital system at a given time.,real
"Donald Trump Diagnosed with ADTD, or Attention Deficit Tweet Disorder https://t.co/m3MMyJpe7p #donaldtrump #covid19 #pandemic",fake
Our combined total of confirmed and probable cases remains at 1504. The number of recovered cases is unchanged at 1481. Only one case remains active. There are no additional deaths to report.,real
The increase in deaths is due to a backlogged addition of probable deaths in Arkansas. The state reported 147 COVID-19 deaths today a noticeable uptick. We hope to see a backfilled time series moving forward.,real
A man was beaten by the cops in Dehradun India after he violated the lockdown norms and came out to spit on people's doors and handles.,fake
"The science is clear."" Meharry’s Dr. James Hildreth says despite CDC backtrack, COVID-19 is airborne",fake
#StayAtHome to #SlowTheSpread of cases of COVID in your area. @JohnsHopkins and @AEI both recommend governments be sure that COVID cases have been decreasing in their area for at least weeks before reopening.,real
RT @AyushmanHWCs: The Mahila Arogya Samitis in #Kerala continue to provide care and basic necessities including food medicines masks hy…,real
“We cannot solve problems of over 60 years in 6 weeks As we work hard to reduce risk #COVID19 infection to health care workers on the frontlines we need a fundamental change in our approach to infection prevention &amp; control in #Nigerian hospitals” ~ @Chikwe_I at #PTFCOVID19 https://t.co/H3s2muzAee,real
Understanding how COVID-19 affects patients with schizophrenia. https://t.co/dyHYMrtT80 via @ColumbiaMed https://t.co/cnw8zF3lum,real
RT @EllenCutch: Coronavirus misinformation is moving offline. A reddit user posted this flyer to the site and told us it had been delive…,fake
🎧 New Podcast: Can wearable tech + AI converge to predict diseases like #COVID19? https://t.co/YAdqa2CpFG with @EricTopol @cuttingforstone,real
Chlorine dioxide has already proved efficacious as a mouthwash to decreases the load of the covid-19 virus. Bolivia has used it as a safe and effective treatment to eradicate the virus. @ICMRDELHI @CSIR_IND Please can we do a Clinical trial in India? https://t.co/GQKIBmaWPn,fake
All Other News Suspended Over Coronavirus https://t.co/4l2bWuVCX6,fake
We’re working with vaccine manufacturers to provide all countries that join the effort timely and equitable access to all vaccines licensed and approved. This doesn’t just pool risk it also means that prices will be kept as low as possible.-@DrTedros #COVID19,real
TODAY at 2:30pm ET: Join @drsanjaygupta @AngieHolan and @AlexMahadevan on Facebook Live where they'll discuss COVID-19 misinformation and answer your questions. https://t.co/zSH1XfZE5Y https://t.co/2viMPDE39d,fake
A video claims Italy discovered that COVID-19 is bacteria not a virus,fake
Eleven new cases of #COVID19 have been reported in Lagos State. As at 11:00 pm 14th April there are 373 confirmed cases of #COVID19 reported in Nigeria. 99 have been discharged with 11 deaths #TakeResponsibility https://t.co/XtcbJ4qxA6,real
Vaccines against pneumonia protect against novel coronavirus,fake
WHO backtracked and now argues that all economies should be reopened immediately,fake
"""Huge! Results From Breaking Chloroquine Study Show 100% Cure Rate For Patients Infected With The Coronavirus.""",fake
RT @drharshvardhan: #COVID19 UPDATE 👉India continues to scale new peaks in COVID-19 tests 👉More than 11.70 lakh samples tested for 2 cons…,real
#CoronaVirusUpdates: State-wise details of Total Confirmed #COVID19 cases(till 02 September 2020 8 AM) ➡️States with 1-10000 confirmed cases ➡️States with 10001-90000 confirmed cases ➡️States with 90000+ confirmed cases ➡️Total no. of confirmed cases so far https://t.co/EWrtWHNrK8,real
While the percentage of lab specimens testing positive for #COVID19 decreased nationally from last week the latest #COVIDView report notes slight increases in the Southeast and Pacific Northwest. Learn more: https://t.co/zP4VYlo0Pb https://t.co/LBHnEiyhV2,real
The message claimed that under the Disaster Management Act (DMA) nobody except the Indian government can update and post coronavirus related information on social media.,fake
Another 3 million Americans filed jobless claims last week bringing total to 33 million since coronavirus hit #unemployment https://t.co/a7e1W1NCPi,fake
Golf courses are reopening in Ireland on 2nd May.,fake
Pier Luigi Bersani,fake
"Says a ""Clorox bottle claimed it could kill (the 2019 coronavirus)... before it was developed.""",fake
COVID-19 Update There are no new cases of COVID-19 to report in New Zealand today. There are 39 people isolating in the Auckland quarantine facility from the community which includes 18 people who have tested positive for COVID-19 and their household contacts. https://t.co/QQ2Z5iPZYm,real
Text claims that half of the members of the ruling party in North Macedonia (SDSM) became infected with COVID-19 getting it from the Vice President of the party Muhamed Zekiri and that the party is becoming a new COVID-19 cluster.,fake
People said there will be flying cars in 2020 while we are still learning to wash our hands. #COVID19,fake
We have stock of more than 270000 tests available across the country with more stock coming in at all times. We can process more than 12000 tests per day and we are looking to increase this over the next few days.,real
"Message from health authorities chandigarh :
Hello i kindly request you not to come out of your house after 10 pm tonight till tomorrow 5 am.... As their will be spraying medicine in the air in order to kill the COVID-19!!
Share this information to all your friends,relatives and your families...for Chandigarh
Thank you!",fake
"This Important video shows the 
""spread of #Corona VIRUS ""
 from human to human filmed with the most advanced HIGH TECH CAMERA IN JAPAN 👆🤔😲 https://t.co/Z5eabhYpvF",fake
You can get the latest from The COVID Tracking Project delivered straight to your inbox. Sign up to get updates and our weekly newsletter here: https://t.co/aaJlWd6YUZ,real
Dr. Stella Immanuel says a cure has been found for COVID-19,fake
"#covid19 #coronavirus #coronavirusupdate Police in Spain, keeping kids entertained during the lockdown by performing Baby Shark. ❤

This is the best thing we saw all During Corona Crisis #COVID19 https://t.co/9bJdWHW6Kx",fake
“Joe Exotic tests positive for coronavirus in prison. It’s been confirmed.”,fake
Unfortunately today there are four people in hospital with COVID-19 – two are stable and in isolation on wards - one in Middlemore and one in North Shore hospitals. Two are in ICU at North Shore and Waikato hospitals. We want to send them and their families our aroha.,real
Works at the Luque cemetery near paraguayan capital Asunción are related to people who died from COVID-19.,fake
"Office Memorandum of the Indian Ministry of Health and Family Welfare declaring holidays to the states of Maharashtra, Gujarat, Uttar Pradesh and Sikkim in the wake of COVID-19.",fake
Chief Secretary of West Bengal was not following relaxing while the state was performing poorly as it fought COVID-19.,fake
"Ramnavmi celebrations in Akbarpur, UP, today.But we should only bash Tabligi Jamat of Nizamuddin Makraz.",fake
Update from the @minhealthnz ​ There are no new cases of COVID-19 to report today.​ ​The number of active cases in NZ remains at 22. All active cases have recently returned from overseas and were in managed isolation facilities. There are no cases of community transmission.,real
Untreated Vitamin D deficiency linked to an increased risk of COVID-19. https://t.co/QpNLo6zTvI,real
"Wondering how you can do your daily activities safely while protecting yourself and your loved ones from #COVID19? To help you determine your level of risk answer these questions about “Deciding to Go Out:"" https://t.co/g9sT0JqtEx. https://t.co/tZOt2qAzP8",real
Some cancer trials interrupted by COVID are now being revived. https://t.co/EwFPQbxJSJ https://t.co/Bs7VHOyAvq,real
Brazilian congressman João Campos denied using elections fund in measures to prevent COVID-19.,fake
RT @nytimes: Black and Latino people in the U.S. are 3 times as likely to contract the coronavirus than their white neighbors — and nearly…,real
"Because of Donald Trump's negligence and incompetence:
 
- More than 110,000 people have died
- We have nearly 2 million cases of COVID-19
- Over 20 million Americans are out of work
 
And yet he’s patting himself on the back. Unbelievable.",fake
#IndiaFightsCorona: @MoHFW_INDIA has been regularly engaging with States and UTs that have been exhibiting either a sudden surge in #COVID19 cases high caseload or reporting a higher mortality in some districts. #StaySafe #IndiaWillWin Details: https://t.co/IcHoboXycy https://t.co/YFOzaHLnRl,real
"A Whatsapp message which claims that the Italian government sent ""Nas"" (a branch of the Carabinieri) to close the department in charge of plamsa-related therapies at Mantua hospital where ""they cure COVID-19 in 48 hours"". The government would have done that in order to obtain ""Bill Gates' vaccine"".",fake
Money was taken from hospitals to finance cultural projects in Brazil.,fake
• We now have 1411 people reported as having recovered from COVID-19 an increase of 9 on yesterday. This is 94% of all cases.⁣ ⁣ • Today there are two people receiving hospital level care for COVID-19 – one each in Auckland and Middlemore hospitals. Neither are in ICU.⁣,real
For one thing only half of states report them despite direction to do so from the CDC. Also although probables currently account for less than 1% of the nat'l total they make up 8-20% in the states with the highest proportion of probables and 75% of all cases in Puerto Rico.,real
People will not be allowed to organize a funeral for any family members who die of COVID-19. Instead the state will take care of the disposal of the body.,fake
"Rent is due today.

Donald Trump abdicated his responsibility to lead us out of this COVID-19 crisis—and we now face a potential housing crisis because of it.

Mr. President: Act now to make sure Americans don't have to choose between a roof over their heads or food on the table. https://t.co/b0Uoy5qoFr",fake
"Former NYC Mayor Rudolph Giuliani said he ""bought $2M in shares of Novartis a primary supplier of hydroxychloroquine"" in early February.",fake
Intensive care units are either full or about to reach saturation. More bed capacity is desperately needed but staffing is an issue @skynewsmichelle witnesses the impact a second wave of #COVID19 is having in Marseille https://t.co/7X1Dzibi8k,real
"Herd Immunity Strategy is ‘Unethical and Unlikely to be Successful in the UK, warn scientists, as Long Covid Sufferers call for more recognition https://t.co/Stier2vBzO",fake
