tweet,label
Three of the people who have tested positive are employees of Americold the workplace of one of the previously reported cases. Another 7 cases are families of these employees. 2 Americold Sites in Mt Wellington and Auckland Airport have been closed.,real
High streets across England are set to benefit from a £95 million government-funded scheme to help them recover from the impact of #COVID19. Chief Executive of Historic England Duncan Wilson #Breakfast. 🕤 0940 📺 Channel 501 📱 Watch live: https://t.co/IhbWCO8lbl https://t.co/tyuUuvlaoe,real
High-touch shared items of equipment such as thermometers blood pressure cuffs and stethoscopes can spread #coronavirus. https://t.co/O0G5h9yP1u,real
#IndiaFightsCorona India has tested more than 3.5 crore people for #COVID19 so far resolutely following its 'TEST TRACK TREAT' strategy. @PMOIndia @drharshvardhan @AshwiniKChoubey @PIB_India @COVIDNewsByMIB @CovidIndiaSeva @DDNewslive @airnewsalerts @ICMRDELHI @PTI_News https://t.co/tcm38I6wPe,real
This month’s blood disorder webinar will discuss #COVID19 associated VTE risks and considerations. Pre-register now and join us September 17 at 2 p.m. ET: https://t.co/GUDbPY0X9d. https://t.co/bwBHKKHTV3,real
"Researchers claim 100 percent cure rate vs. covid-19 in 100+ patient trial conducted in Ecuador, using intravenous chlorine dioxide.",fake
The FTSE 100 and the pound have come under renewed pressure as investors eye the prospect of tougher coronavirus restrictions returning across the UK and much of Europe https://t.co/2Jx54pxlmd,real
The existence of a canine coronavirus vaccine casts doubt on statements that there isn’t one for humans.,fake
"#coronavirus ?? ?? Large Explosion in Wuhan, China just happened about an hour ago #wuhan #WuhanCoronavirus 1/24/2020",fake
A RAI TV show from 2015 warned about Chinese research to create a new coronavirus from other virus parts. It all took place in Wuhan.,fake
Latest updates from the Director-General Health and the Police Commissioner ​ ​ • There are no new cases of COVID-19 to report today​ • This means New Zealand’s combined total of confirmed and probable cases is 1499 of which 1149 are confirmed cases of COVID-19 https://t.co/LrsW6Dshxw,real
#CoronaVirusUpdates Mortality analysis: Age-wise: -50% deaths belong to 60 years and above age group. -37% deaths belong to 45-60 years age group. -11% deaths belong to 26-44 years age group. Gender-wise: -68% deaths were among men. -32% deaths were among women. https://t.co/unj31Uemeh,real
Inhaling hot water steam can kill coronavirus.,fake
_Israel has manufactured the coronavirus vaccine_,fake
RT @PIB_India: Many states have increased their testing capacity both RT - PCR and Rapid Antigen tests. 24 States/UT's have more tests per…,real
Social media posts claim that actors were caught in the act staging fake COVID-19 cases.,fake
Our daily update is published. States reported 726k tests and 47k cases the highest numbers since Sunday. The death toll is 1118. https://t.co/Mpq8TTItw5,real
Our daily update is published. States reported 763k tests 37k cases and 663 COVID-19 deaths. Important caveat: this update does not include Texas’s daily data which is still not in today. https://t.co/gRVcvQlarp,real
Here's our daily update for 3/11: we have tracked 7617 cumulative people tested here in the US by tallying individual state reporting. That's up from 4889 yesterday. NOTE: We cannot capture all negative tests because not all states report them. https://t.co/BS0es79Hew,real
There were more deaths on the roads of France in July than death from COVID-19,fake
Man Has Decided To Get Fit https://t.co/KKXZbJKcyv #health #coronavirus #exercise #fitness,fake
PUBLICATION: #COVID19 #Coronavirus in Vo Italy ➡️43% asymptomatic infections across 2 surveys ➡️No difference in viral load symptomatic vs asymptomatic infections ➡️Mean serial interval 6.9 days ➡️Lockdown suppressed #SARSCoV2 transmission 🔰Full report https://t.co/aNGdy6g8pm https://t.co/pyrjEGQdgs,real
"Not only #AmitabhBachchan but also all covid patient get well soon💚....
Or eshe bhi rishte wo corona k baap lgte h😎
.
.
God bless all everything gonna be fine soon. https://t.co/JEqj3FfOHg",fake
There are now 74 people linked to the Auckland community cluster who remain in the Auckland Quarantine facility that includes 58 people who have tested positive as well as a number of household members.,real
Did you know September is Sepsis Awareness Month? Sepsis is the body’s extreme response to an infection and is a life-threatening medical emergency. Learn how you can protect yourself and your family: https://t.co/rSkIkgkT4b. #sepsis #SAM2020 https://t.co/l6cghT9RWN,real
Germany has sent China a bill of £130 billion for damages caused to the economy due to coronavirus.,fake
Metformin may lower risk for fatal COVID-19. https://t.co/cvSpDG2nc4 https://t.co/ohQNkDrFPi,real
Mumbai's KEM hospital prescribed list of medicines to self-medicate for COVID-19,fake
As we unite to recover from the effects of COVID-19 it's still important that we keep the basic hygiene measures including washing your hands and coughing or sneezing into your elbow.,real
We just announced a collaboration with @Rovi_IR for OUS fill-finish manufacturing of our COVID-19 #vaccine candidate. Read more here: https://t.co/3EdEYj80xZ #mRNA https://t.co/iJMZxJTi2B,real
@_devBhatt @MoCA_GoI As of 1st July 2020 @MoCA_GoI has safely operated 785 Domestic Flights and handled 71471 passengers. https://t.co/w9j4LCLcvE,real
A claim that facemasks restrict breathing and cause hypoxia.,fake
"Nancy Pelosi said, ???if you accept a check from Trump, you might as well vote for him.??�",fake
WHO said vegetarians will not be affected by COVID-19 because COVID-19 need to have animal fain order tosurvive.,fake
IndianTelecommunication Department offering free internet services during lockdown to work from home.,fake
The Facility is the critical mechanism for joint procurement and pooling risk across multiple vaccines so that whatever vaccine is proven to be safe and effective – all countries within the Facility will be able to access them.-@DrTedros #COVID19 https://t.co/veskE4kCVi,real
A picture quotes pharmacist Stefano Montanari saying that wearing protective masks would make people breathe excessive levels of carbon dioxide leading to respiratory acidosis and cancer.,fake
The owner of the Indian jewellry group Joyalukkas died due to COVID-19.,fake
"IMPORTANT INFO FOR SURGICAL MASK USERS 😷

✅ White side facing outwards if you want to protect yourself. 

✅ If you have flu, blue or green side facing outwards to prevent the germs from spreading outwards.

#COVID19Pakistan #COVID2019 #CoronaVirusUpdate",fake
We need to ensure that every person who needs a coronavirus test can get one — and that the test is free. Period.,fake
With neither free coffee nor company-branded tchotchkes online medical meetings may have virtual tumbleweeds blowing through says @JackWestMD. https://t.co/71zrMCrFbG https://t.co/6bAHJ1NRet,real
Right now our model shows that: 📉5 states have reduced risk in re-opening 19 have moderate risk in re-opening 📈26 have elevated risk in re-opening. Find out more about your state and county at https://t.co/DYojLfjhyd. https://t.co/XiXeXDCCG5,real
California had seen rising case counts but its other numbers looked solid—% positive was low hospitalizations were not growing—but this week the state appears to be turning. https://t.co/QNTloVs9cZ,real
Seen those pictures of dolphins and swans returning to Venice's canals? They've been debunked Today we launch CoronaCheck a newsletter with the latest debunked COVID-19 misinformation from around the world: https://t.co/b5r37qINqy #factcheck #CoronaVirusFacts #DatosCoronaVirus,fake
UPDATE: #COVID19 in US ➡️63.4% of COVID-19 cases from adults (20-49) ➡️1.2% of COVID-19 cases from children (0-9) ➡️Reproduction nr &gt;1 for adults aged (35-49) ➡️Target interventions at adults (20-49) can facilitate safe reopening of schools 👇Report: https://t.co/sYsILcsiTH https://t.co/TZeagemqrl,real
Video shows muslim women spitting in plastic bags and throwing them into the houses to spread coronavirus.,fake
13 additional cases have recovered so our total number of active cases is 97. Of those 39 are imported cases in MIQ facilities and 58 are community cases.,real
Kate Middleton and Other Celebrities Spark Pregnancy Speculation Amid Coronavirus Quarantine https://t.co/p9sRnIppKx,fake
Given the shortage of N95 respirators during this global outbreak of #COVID19 it’s important to understand the difference between N95 respirators and surgical masks and how both are intended to protect healthcare workers. Learn more from @NIOSH: https://t.co/rGGoSYmo30. https://t.co/HJNQfoAWk9,real
The @NYTimes found Latinos and African Americans in the U.S. are three times as likely to become infected with COVID-19 as white people. Black and Latino people are also twice as likely to die from COVID-19 as white people. https://t.co/yJldxlPWqe https://t.co/zkOSxN0QTL,fake
338 new cases of #COVID19; 177-Lagos 64-Kano 21-FCT 16-Rivers 14-Plateau 11-Oyo 9-Katsina 4-Jigawa 4-Kaduna 3-Abia 3-Bauchi 3-Borno 2-Gombe 2-Akwa Ibom 2-Delta 1-Ondo 1-Kebbi 1-Sokoto 5959 cases of #COVID19 in Nigeria Discharged: 1594 Deaths: 182 https://t.co/1nC9HjskN3,real
Another New York note: the state has not released new positive or total test numbers yet today. NY has been reporting 17-26k tests per day.,real
85% of PCPs report #COVID significantly changed their work; 77% of specialists report the same. https://t.co/xnOPr6vYle,real
#IndiaFightsCorona India's #COVID19 recoveries cross the historic peak of 1.5 million. @PMOIndia @drharshvardhan @AshwiniKChoubey @PIB_India @DDNewslive @airnewsalerts @COVIDNewsByMIB @CovidIndiaSeva @ICMRDELHI @mygovindia,real
Gun-toting Michiganders Burn Witch As They Protest State's Coronavirus Lockdown https://t.co/5VFUk6vrkY,fake
Serbian PM stated that citizens of South Korea have to pay to get tested for the coronavirus.,fake
RT @drharshvardhan: #CoronaVirusUpdates ! 👉New recoveries in India have exceeded the new cases for the last six days 👉The total number of…,real
Confused about mortality rate for coronavirus and case-fatality rate? We explain the difference here. https://t.co/wvIo4b4EfF,fake
In the third week WHO identified &amp; began contracting for validated production of quality PCR tests. And by the first week of Feb WHO began shipping tests to over 150 labs around the world which enabled the world to track &amp; trace #COVID19 around the world quickly-@DrTedros,real
We just locked our 4pm update. We tallied ~1700 new cases. There were only 778 cumulatively last Tuesday. Our dataset is very complex. Make sure you use it responsibly. Here's what you need to know: https://t.co/3qgCMXHMjq,real
“Now as the virus is spreading once more we have had to act.” Health secretary Matt Hancock explains what local measures have been taken to try and stop the spread of #coronavirus. Follow live here: https://t.co/OWTJVEZyWH https://t.co/V84tSPhFP6,real
About antibody testing... 1) It is necessary to separate out these tests. 2) Antibody testing remains a small portion of the cumulative tests performed. 2) US viral testing really has scaled up a ton. 4) Antibody tests have grown as a % of daily tests. Colorado e.g.: https://t.co/sCyn5aASMV,real
CASE STUDY: About 22% of children with COVID-19 were asymptomatic and 66% of the symptomatic children had unrecognized symptoms at the time of diagnosis. https://t.co/qfEeb1PVvi https://t.co/boNE3vJmZD,real
For a breakdown of cases by states in real time please see https://t.co/zQrpNeOfet Currently; Lagos- 19 FCT- 3 Ogun- 2 Ekiti- 1 Oyo- 1 Total: 26 confirmed cases #COVID19Nigeria,real
The first tranche of people should be into the user groups in our Slack. Note: we're thinking of these channels as largely peer support for working with this data. But it's been fascinating just to see the different types of users too. Sign up: https://t.co/ixqXU6X2b7,real
Men scramble to find a personality after CDC suggests shaving beard to stop coronavirus https://t.co/mP3SpdaKtl,fake
Infusing hospitalized COVID patients with blood plasma from the recovered appeared to show a benefit in a nationwide survey but the study’s lack of a placebo group left several researchers unable to properly interpret the data. Quick read by @statnews: https://t.co/xhPHXURnvy,real
The number of cases is rising in all UK regions but compared to other areas the capital appears to be controlling the virus better than some regions that had similar or higher infection rates in April and May https://t.co/OYRHWuuNMN,real
Protect yourself and others from #COVID19 when using public transportation. Practice social distancing avoid touching surfaces and practice hand hygiene. Learn more: https://t.co/0vhHD4uFv9. https://t.co/D8YSeE3vXv,real
Coronavirus: Christmas is the best time for new lockdown measures says Oxford expert https://t.co/a8QtPYgzik,real
CNBC claims COVID-19 survives in air for 8 hours; paper and plastic for 3-4 hours,fake
"@Vic_Rollison @SwannyQLD The Age newspaper has reported that ""patient zero"" in Victoria's second wave of coronavirus was a night duty manager at Melbourne's Rydges on Swanston hotel, https://t.co/CaZgWWBqPw",fake
“With the absence of a vaccine💉 non-pharmaceutical interventions such as use of face masks😷 physical distancing &amp; hand hygiene 🧼 remain the most effective strategy to limit #COVID19 spread” ~Boss Mustapha @PTFCOVID19 Chairman. 📺 Livestream ongoing press briefing here👇🏽 https://t.co/b0VPjj7wdc https://t.co/cFLXpm1fyN,real
The weekend lag effect is pronounced in death reporting. For example last week CA reported 6 deaths on Monday then 111 on Tues. AZ reported 1 death Mon then 117 on Tues. Today AZ reported 8 deaths. CA 23. All these data are the outputs of complicated human processes. https://t.co/WkN4aqCiGT,real
China concerned Western authoritarian government will cover up coronavirus outbreaks #CoronaVirusUpdates #COVIDー19 https://t.co/yD7vE5m4ru https://t.co/ZMcntcEqEw,fake
567 positive cases and 39 deaths from COVID-19 were recorded in Mali on April 13 2020.,fake
#IndiaFightsCorona: Similarly India's #COVID19 Deaths per Million Population is also amongst the lowest in the World: Secretary @MoHFW_INDIA #StaySafe #IndiaWillWin @ICMRDELHI https://t.co/lqQuxdRTd2,real
321 new cases of #COVID19Nigeria; Lagos-98 FCT-34 Kaduna-30 Nasarawa-25 Benue-21 Plateau-17 Rivers-15 Adamawa-11 Ogun-11 Enugu-9 Edo-8 Delta-7 Ekiti-7 Gombe-5 Ebonyi-4 Bayelsa-3 Kano-3 Ondo-3 Cross River-2 Imo-2 Kebbi-2 Niger-2 Abia-1 Bauchi-1 https://t.co/zgHMVmHxYz,real
Brahmins (a Higher Indian Caste) chopped off a girl's tongue as an offering to God to prevent COVID-19 infection.,fake
#IndiaFightsCorona: Highest ever single day recoveries of 66550 in last 24 hours India scales another peak: Total recoveries cross 24 lakh More than 100% increase in Recovered Cases in last 25 days #StaySafe #IndiaWillWin https://t.co/y31nn33zho,real
Hospital capacity is difficult to increase. It's like if 100 people try to go through a doorway at once there will just be a log jam. But if people go through 1 by 1 then everyone will get through easily. Overloaded hospitals mean people die unnecessarily. #StopTheSpread,real
"Herd Immunity Strategy is ‘Unethical and Unlikely to be Successful in the UK, warn scientists, as Long Covid Sufferers call for more recognition https://t.co/768Kxdyuxh",fake
"Senate Majority Leader Mitch McConnell in May 2020 claimed that ""clearly the Obama administration did not leave to [the Trump] administration any kind of game plan for"" pandemics.",fake
Fourteen new cases of #COVID19 have been reported in Nigeria; 9 in Lagos and 5 in FCT As at 09:30 pm 29th March there are 111 confirmed cases of #COVID19 reported in Nigeria with 1 death. https://t.co/qowI0bEPAg,real
_The President of the United States of America Donald Trump has been tested positive for COVID-19._,fake
Daily numbers from Texas included a backlog of 8000 COVID-19 cases. We removed the historical count from the daily value for trend consistency but have included them in our cumulative numbers on the website. https://t.co/W2Q4CGocJU,real
Bit of a surprising day. Fewer tests and positives than expected for a Tuesday. Only ~18k cases reported today which substantially brought down the 7-day average. Cases getting to very low levels in New England and mid-Atlantic states. https://t.co/V4Sa2Umgm7,real
So we could expect a substantial portion of infections to result in hospitalizations after only a few days. Thanks for your question @lolageek!,real
Russia already has a vaccine to fight COVID-19.,fake
#IndiaFightsCorona: India has the highest recovered cases in the world. India contributes 17.7% share in the total #COVID19 cases. However in terms of recovered cases India shares 19.5% of the total recovered cases: Secretary @MoHFW_INDIA @ICMRDELHI #StaySafe https://t.co/Dd3i8E2lqf,real
#CoronaVirusUpdates: State-wise details of Total Confirmed #COVID19 cases(till 12 September 2020 08:00 AM) ➡️States with 1-15000 confirmed cases ➡️States with 15001-100000 confirmed cases ➡️States with 100000+ confirmed cases ➡️Total no. of confirmed cases so far https://t.co/LR066ba41j,real
Indian government’s Ministry of AYUSH asked Patanjali Ayurved to stop advertising that it’s found the cure for Coronavirus until further examination. Tennis world champion Novak Djokovic tests positive for COVID-19 after taking part in Adria Tour. #COVIDー19 #coronavirusFacts https://t.co/74l5MdUnFf,fake
Dr. Abdul Rahman Al-Youbi Director of King Abdulaziz University in Saudi Arabia shares the news of a new vaccine for Covid-19 created by Saudi doctors.,fake
Yesterday 4225 tests were processed which brings the total to 502705 tests processed overall.,real
For a breakdown of cases by states in real time please see https://t.co/zQrpNeOfet Currently; Lagos- 29 FCT- 8 Ogun- 3 Ekiti- 1 Oyo- 1 Edo- 1 Bauchi-1 Total: 44 confirmed cases #COVID19Nigeria,real
#CoronaVirusUpdates #IndiaFightsCorona Centre directs 13 dist. from 8 States to focus all efforts to reduce #COVID19 mortality. https://t.co/b5CasVfZGZ @PMOIndia @drharshvardhan @AshwiniKChoubey @PIB_India @DDNewslive @airnewsalerts @mygovindia @COVIDNewsByMIB @CovidIndiaSeva,real
#IndiaFightsCorona: Nearly 57% of the new cases are reported from only five States. These are the same States that are also contributing 60% of the new recovered cases. #StaySafe #IndiaWillWin https://t.co/KEhb1d9w8F,real
Says businesses will give you free baby formula during the coronavirus outbreak.,fake
COVID may lead to a generation of lost medical research. https://t.co/PvbLHx1jpq,real
Nasal flu vaccine side effects do not cause covid,fake
#CoronaVirusUpdates #IndiaFightsCorona Record highest single day #COVID19 recoveries of 56110 registered. In the first week of July daily average recovered cases were at 15000 which jumped to more than 50000 in the first week of August. https://t.co/D68hXADQ1X https://t.co/XVkaN77vCS,real
The Emergency Committee on #COVID19 unanimously agreed that the outbreak still constitutes a public health emergency of international concern. @DrTedros accepted their advice &amp; confirmed that the outbreak continues to constitute a global health emergency: https://t.co/N128pKjOKx,real
"After all the depressing news, came across something so true and motivating. My level of respect for Mr Ratan Tata is inexplicable...",fake
A new @CDCMMWR on #COVID19 infections among Oregon residents found about 1% of specimens tested had evidence of a past infection – 10 times the rate of infections identified by conventional testing. Wear masks. Social distance &amp; wash your hands. See more: https://t.co/mMPpxFUSyR. https://t.co/eacIpi9AH8,real
American scientists have developed a cure for the coronavirus.,fake
"Coronavirus vaccines will change recipients' DNA and ""the Covid-19 vaccines are designed to make us into genetically modified organisms.""",fake
Testing remains down. Most of the decline in the 7-day average for tests completed is in the South. This kind of decline is not what we saw from Northeastern states as they emerged from their intense outbreaks in the Spring. https://t.co/jGd4dHRfWF,real
Indian politician Uddhav Thackeray has asked Christians to pray to Jesus to stop COVID-19.,fake
???if your child gets this virus their going to hospital alone in a van with people they don???t know...to be with people they don???t know??? you will be at home without them in their time of need.??�,fake
#IndiaFightsCorona #COVID19 infection still remains concentrated in 10 States that contribute more than 80% of the new cases.,real
Our daily update is published. We’ve now tracked 3.2 million tests up 161K from yesterday a noticeable uptick from the April avg of ~145k tests. Note that we can only track tests that a state reports. And not all states report all tests. See: https://t.co/PZrmH3TKeq,real
A case of coronavirus in the Argentine province of Santiago del Estero was confirmed.,fake
"Health Secretary Matt Hancock has admitted there are ""challenges"" with the #coronavirus testing system following a ""sharp rise"" in demand. More on this story here: https://t.co/qOGlv74NgA https://t.co/S2kUssV8cq",real
Eight significant clusters have closed this is unchanged from yesterday. A cluster is considered to be closed when there have been no new cases for two incubation periods (i.e. 28 days) from the date when all cases have completed isolation. #covid19 #COVIDー19 #covid19nz,real
@WeVotedToLeave @PathogenScribe In India they are prescribing antihistamines daily as part of their routine prescriptions for home management of mild covid.,fake
From June 10 to July 10 these five states have seen generally rising cases and steadily increasing hospitalizations. https://t.co/FVvJQLX0f7,real
20 million Chinese convert to Islam and coronavirus does not affect Muslims.,fake
A police officer in Bihar’s Bhagalpur Central Jail has tested positive for coronavirus.,fake
The reasons for disrupted immunization services vary. Even when services are offered people are either unable to access them because of reluctance to leave 🏠 transport interruptions economic hardships restrictions on movement fear of being exposed to ppl with #COVID19 https://t.co/iWBLf9jNo3,real
A further 3105 people have tested positive for #COVID19 in the UK over the last 24 hours – up from 2621 yesterday. Follow live updates as daily figures come in 👇 https://t.co/pSSGfffuGH,real
Amitabh Bacchan tests negative to COVID-19,fake
An image shows what the virus in the air looks like under the most advanced microscope.,fake
COVID convalescent plasma and the ❤️ : this week with @drjohnm. https://t.co/KzjHt9JN2Y #cardiotwitter https://t.co/oOu23HRgXn,real
We’re grateful for the leadership &amp; support from @AfricaCDC to National Public Health Institutes in Africa including NCDC When the 1st #COVID19 case was confirmed in China @AfricaCDC &amp; @WHOAFRO provided training to lab risk comms IPC &amp; case management personnel in Nigeria https://t.co/uXsOdLHrj8,real
Inference projections are a massive step forward. Among their many benefits is that projections now implicitly take into account local factors such as population density or compliance with anti-COVID interventions. Read more about Inference Projections: https://t.co/lxpUXvogrn https://t.co/CjXswLuY64,real
#IndiaFightsCorona: The vaccine developed by Russia has been under consideration of the country. Govt of Russia approached our govt &amp; sought help on 2 counts- to consider its manufacturing through our network of companies &amp; phase 3 studies in India: Member (Health) @NITIAayog https://t.co/J6HXFkuuDB,real
Looks like COVID immunity may fade within months. https://t.co/sqEPMHrjyt https://t.co/UW7DK7xyAj,real
"We have to ensure every worker called back on the job has access to regular, reliable COVID-19 testing and effective personal protective equipment. https://t.co/lDPQP3jZkw",fake
NEWS! Nigel Farage to teach kids climate change denial for ‘balance’ in BBC Lockdown Learning Scheme https://t.co/kiLDWF1TNj https://t.co/7rhsHm9EbQ,fake
#IndiaFightsCorona: India's #COVID19 Cases per Million population is amongst the lowest in the world; which stands at 2792 for India and 3359 for the World: Secretary @MoHFW_INDIA #StaySafe #IndiaWillWin @ICMRDELHI https://t.co/pC7O9H86oP,real
Dawood Ibrahim died of Covid-19.,fake
1651 deaths were reported bringing the total in our dataset to 60710. This does not include 5126 probable COVID-19 deaths reported by NYC but not by New York State. We're working on separate accounting of lab-confirmed and probable deaths for all states where we can do so. https://t.co/J7rBzYS4RZ,real
#IndiaFightsCorona Early identification followed through with prompt isolation and effective treatment in hospitals leading to falling percentage of active #COVID19 cases in india. https://t.co/HVHHI0Nk9k,real
ICYMI: @NPR interviews a FDA adviser who doesn't believe effective COVID vaccine trials will be completed by end of 2020. Subscribe to our daily newsletter for more COVID related news &amp; updates here: https://t.co/qp7dmrWVvM. Full story: https://t.co/b2Rf1Ev6Rc,real
108 new cases of #COVID19 have been reported; 78 in Lagos 14 in FCT 5 in Ogun 4 in Gombe 3 Borno 2 in Akwa Ibom 1 in Kwara 1 in Plateau As at 11:30 pm 23rd April there are 981 confirmed cases of #COVID19 reported in Nigeria. Discharged: 197 Deaths: 31 #TakeResponsibility https://t.co/cq7STlnHGJ,real
Trump Family To Go Into Facemask Production https://t.co/kGWvJlhABr #donaldtrump #coronavirus #fashion #ivankatrump #facemasks,fake
"Covid-19 Appointed Housing Minister After Freezing Rents, Evictions &amp; Securing Beds For Homeless https://t.co/IYrRXItIeb",fake
